{
  "v": 1,
  "id": "boulangerie",
  "name": {
    "en": "The corner bakery",
    "fa": "نانوایی سر نبش",
    "tr": "Köşedeki fırın"
  },
  "district": "Le Marais, Paris",
  "outdoor": true,
  "size": {
    "w": 12,
    "d": 6
  },
  "pieces": [
    {
      "kit": "sky_clouds",
      "n": 4,
      "x": 0,
      "y": 6,
      "z": -60
    },
    {
      "kit": "townhouse",
      "kind": "haussmann",
      "seed": "bakery_left",
      "floors": 4,
      "bays": 3,
      "x": -6.2,
      "z": -4.5
    },
    {
      "kit": "townhouse",
      "kind": "haussmann",
      "seed": "bakery_mid",
      "floors": 4,
      "bays": 3,
      "x": -0.6,
      "z": -4.5,
      "lit": 0.4
    },
    {
      "kit": "frontage",
      "variant": "boulangerie",
      "id": "shop",
      "x": -0.6,
      "z": -4.35,
      "w": 300
    },
    {
      "kit": "townhouse",
      "kind": "haussmann",
      "seed": "bakery_right",
      "floors": 4,
      "bays": 3,
      "x": 5.2,
      "z": -4.5
    },
    {
      "kit": "flag",
      "variant": "x_tricolore_bunting",
      "x": -0.6,
      "y": 3.4,
      "z": -4.0
    },
    {
      "kit": "floor",
      "x": 0,
      "z": -4.4,
      "w": 1700,
      "d": 420,
      "tile": 45,
      "a": "#C4BCB0",
      "b": "#B9B1A4"
    },
    {
      "kit": "cobbles",
      "x": 0,
      "z": -1.2,
      "w": 1700,
      "d": 600
    },
    {
      "kit": "cafe_terrace",
      "variant": "awning",
      "n": 2,
      "name": "Café du Coin",
      "lang": "fr",
      "x": 3.7,
      "z": -2.9
    },
    {
      "kit": "lamp_post",
      "variant": "gas",
      "x": -2.9,
      "z": -1.3
    },
    {
      "kit": "tree",
      "x": -8.6,
      "z": -3.4,
      "season": "autumn"
    },
    {
      "kit": "bench",
      "variant": "street",
      "x": -3.5,
      "z": -3.2
    },
    {
      "kit": "plant",
      "x": -6.2,
      "z": 0.9
    },
    {
      "kit": "bench",
      "variant": "street",
      "x": 7.6,
      "z": -3.0
    }
  ],
  "marks": {
    "air": {
      "x": 1.2,
      "y": 3.2,
      "z": -2.4,
      "air": true
    },
    "board": {
      "x": -2.45,
      "z": -2.7,
      "facing": "r"
    },
    "front": {
      "x": -0.6,
      "z": -2.9
    },
    "street": {
      "x": -1.6,
      "z": -1.3,
      "facing": "r"
    },
    "walk": {
      "x": 2.4,
      "z": -0.9,
      "facing": "l"
    },
    "window": {
      "x": 0.7,
      "z": -3.0,
      "facing": "l"
    },
    "ledge": {
      "x": -0.6,
      "y": 2.75,
      "z": -4.2
    }
  },
  "perch": "ledge",
  "props": {
    "chalkboard": {
      "kit": "x_cafe_chalkboard",
      "at": {
        "x": 1.45,
        "y": 0,
        "z": -3.3
      },
      "decor": true
    },
    "bread_basket": {
      "kit": "x_bread_basket",
      "at": {
        "x": -2.3,
        "y": 0,
        "z": -3.4
      },
      "decor": true
    },
    "cappuccino": {
      "kit": "cafe_drink",
      "variant": "cappuccino",
      "at": {
        "x": 3.03,
        "y": 0.75,
        "z": -2.9
      },
      "decor": true
    },
    "croissant": {
      "kit": "pastry",
      "variant": "croissant",
      "n": 2,
      "at": {
        "x": 4.37,
        "y": 0.75,
        "z": -2.9
      },
      "decor": true
    }
  },
  "times": [
    "dawn",
    "day",
    "golden",
    "dusk",
    "night"
  ],
  "camera": {
    "wide": {
      "x": 0.6,
      "w": 15,
      "z": -3.2,
      "y1": 7
    }
  },
  "ambience": [
    "street_far"
  ],
  "motif": "street",
  "surface": "stone"
}
