{
  "ambience": [
    "traffic"
  ],
  "camera": {
    "wide": {
      "w": 6.4,
      "x": 0,
      "z": -1.5
    }
  },
  "id": "metro_m11",
  "life": "run",
  "marks": {
    "outside": {
      "air": true,
      "pace": true,
      "x": 2.6,
      "y": 1.45,
      "z": -2.4
    },
    "outside_far": {
      "air": true,
      "pace": true,
      "x": -2.4,
      "y": 1.45,
      "z": -2.6
    },
    "stand_l": {
      "facing": "r",
      "x": -0.55,
      "z": -0.35
    },
    "stand_r": {
      "facing": "l",
      "x": 0.5,
      "z": -0.35
    },
    "window": {
      "x": -2.15,
      "y": 1.4,
      "z": -1.6
    }
  },
  "motif": "street",
  "name": {
    "en": "The metro (M11)",
    "fa": "مترو (M11)",
    "tr": "Metro (M11)"
  },
  "perch": "outside",
  "pieces": [
    {
      "kit": "metro_floor",
      "x": 0,
      "z": -1.65
    },
    {
      "kit": "scroll_view",
      "layer": "clouds",
      "stops": true,
      "w": 3600,
      "x": 0,
      "y": 1.4,
      "z": -13.6
    },
    {
      "kit": "scroll_view",
      "layer": "platform",
      "stops": true,
      "x": 0,
      "y": -0.05,
      "z": -2.6
    },
    {
      "kit": "scroll_view",
      "layer": "hills",
      "stops": true,
      "w": 2200,
      "x": 0,
      "y": -1.3,
      "z": -9.6
    },
    {
      "kit": "scroll_view",
      "layer": "town",
      "stops": true,
      "w": 1300,
      "x": 0,
      "y": -0.6,
      "z": -5.6
    },
    {
      "kit": "scroll_view",
      "layer": "masts",
      "stops": true,
      "w": 1000,
      "x": 0,
      "y": -0.1,
      "z": -2.9
    },
    {
      "kit": "metro_wall",
      "stops": true,
      "x": 0,
      "z": -1.6
    },
    {
      "ends": [
        "Havalimanı",
        "Gayrettepe"
      ],
      "kit": "route_strip",
      "line": "M11",
      "n": 7,
      "stops": true,
      "x": 0,
      "y": 2.1,
      "z": -1.57
    },
    {
      "kit": "metro_display",
      "stations": [
        "İstanbul Havalimanı",
        "İhsaniye",
        "Göktürk",
        "Kemerburgaz",
        "Hasdal",
        "Kağıthane",
        "Gayrettepe"
      ],
      "stops": true,
      "x": 0,
      "y": 2.6,
      "z": -1.56
    },
    {
      "kit": "metro_bench",
      "x": -2.15,
      "z": -1.45
    },
    {
      "kit": "metro_bench",
      "x": 2.15,
      "z": -1.45
    },
    {
      "kit": "metro_straps",
      "x": -2.15,
      "z": -1.22
    },
    {
      "kit": "metro_straps",
      "x": 2.15,
      "z": -1.22
    },
    {
      "kit": "metro_pole",
      "x": -1.12,
      "z": -1.1
    },
    {
      "kit": "metro_pole",
      "x": 1.12,
      "z": -1.1
    },
    {
      "kit": "metro_pole",
      "x": 2.0,
      "z": 0.9
    },
    {
      "id": "pencere",
      "kit": "metro_window",
      "terms": [
        "seed-w02"
      ],
      "x": -2.15,
      "z": -1.59
    },
    {
      "front": true,
      "gap": 46,
      "kind": "sit",
      "kit": "crowd",
      "n": 2,
      "x": 2.61,
      "x0": 0,
      "x1": 46,
      "z": -1.4
    },
    {
      "front": true,
      "kind": "sit",
      "kit": "crowd",
      "n": 1,
      "x": -3.07,
      "x0": 0,
      "x1": 0,
      "z": -1.4
    },
    {
      "kit": "metro_riders",
      "x": 0,
      "z": -1.6
    }
  ],
  "props": {
    "gazete": {
      "at": {
        "x": -1.5,
        "y": 0.45,
        "z": -1.35
      },
      "kit": "print",
      "terms": [
        "a1-w-gazete"
      ],
      "variant": "newspaper"
    },
    "istanbulkart": {
      "at": {
        "x": -2.6,
        "y": 0.45,
        "z": -1.35
      },
      "decor": true,
      "kit": "pass",
      "variant": "istanbulkart"
    },
    "kulaklik": {
      "at": {
        "x": 1.55,
        "y": 0.45,
        "z": -1.35
      },
      "kit": "gadget",
      "terms": [
        "a1-w-kulaklik"
      ],
      "variant": "headphones"
    },
    "sirt_cantasi": {
      "at": {
        "x": 2.0,
        "y": 0,
        "z": -1.2
      },
      "kit": "pack",
      "terms": [
        "a1-w-canta"
      ],
      "variant": "backpack"
    },
    "tren": {
      "at": {
        "x": 5.4,
        "y": -0.1,
        "z": -4.2
      },
      "kit": "metro_alongside",
      "terms": [
        "a1-w-metro"
      ]
    },
    "ucak": {
      "air": true,
      "at": {
        "x": -2.9,
        "y": 1.1,
        "z": -9
      },
      "kit": "airport_plane",
      "terms": [
        "a1-w-ucak"
      ],
      "w": 320
    }
  },
  "site": "metro",
  "size": {
    "d": 3,
    "w": 8
  },
  "stops": {
    "stations": [
      "İstanbul Havalimanı",
      "İhsaniye",
      "Göktürk",
      "Kemerburgaz",
      "Hasdal",
      "Kağıthane",
      "Gayrettepe"
    ]
  },
  "surface": "stone",
  "times": [
    "day",
    "golden",
    "dusk",
    "night"
  ],
  "v": 1
}